A1: 边境语言-Stage100
A11: Stage100为常用词汇，以100代词、动词、介词为主，以字母顺序排序。100个名词按字母顺序排序。100个常用短句。
A21: 序号 | B21: 英文 | C21: 中文 | D21: 法文 | E21: 俄文 | F21: 阿拉伯 | G21: 西班牙 | H21: 日文 | I21: 韩文 | J21: 越文 | K21: 蒙文
A23: =ROW()-22 -> 1 | B23: a | C23: 一个
A24: =ROW()-22 -> 2 | B24: about | C24: 关于
A25: =ROW()-22 -> 3 | B25: accept | C25: 接受
A26: =ROW()-22 -> 4 | B26: again | C26: 再一次
A27: =ROW()-22 -> 5 | B27: all | C27: 全部
A28: =ROW()-22 -> 6 | B28: also | C28: 也
A29: =ROW()-22 -> 7 | B29: and | C29: 和
A30: =ROW()-22 -> 8 | B30: as | C30: 作为
A31: =ROW()-22 -> 9 | B31: at | C31: 在
A32: =ROW()-22 -> 10 | B32: bad | C32: 坏的
A33: =ROW()-22 -> 11 | B33: be/is/are | C33: 是
A34: =ROW()-22 -> 12 | B34: because | C34: 因为
A35: =ROW()-22 -> 13 | B35: but | C35: 但是
A36: =ROW()-22 -> 14 | B36: buy | C36: 买
A37: =ROW()-22 -> 15 | B37: by | C37: 通过
A38: =ROW()-22 -> 16 | B38: can | C38: 能
A39: =ROW()-22 -> 17 | B39: cheer | C39: 欢呼
A40: =ROW()-22 -> 18 | B40: come | C40: 来
A41: =ROW()-22 -> 19 | B41: continue | C41: 继续
A42: =ROW()-22 -> 20 | B42: could | C42: 可以
A43: =ROW()-22 -> 21 | B43: do | C43: 做
A44: =ROW()-22 -> 22 | B44: even | C44: 甚至
A45: =ROW()-22 -> 23 | B45: find | C45: 找到
A46: =ROW()-22 -> 24 | B46: first | C46: 第一
A47: =ROW()-22 -> 25 | B47: for | C47: 为了
A48: =ROW()-22 -> 26 | B48: from | C48: 从
A49: =ROW()-22 -> 27 | B49: get | C49: 得到
A50: =ROW()-22 -> 28 | B50: give | C50: 给
A51: =ROW()-22 -> 29 | B51: go | C51: 去
A52: =ROW()-22 -> 30 | B52: good/better/best | C52: 好
A53: =ROW()-22 -> 31 | B53: goodbye | C53: 再见
A54: =ROW()-22 -> 32 | B54: happy | C54: 高兴
A55: =ROW()-22 -> 33 | B55: have | C55: 有
A56: =ROW()-22 -> 34 | B56: he | C56: 他
A57: =ROW()-22 -> 35 | B57: hello | C57: 你好
A58: =ROW()-22 -> 36 | B58: help | C58: 救命
A59: =ROW()-22 -> 37 | B59: here | C59: 这里
A60: =ROW()-22 -> 38 | B60: how | C60: 如何
A61: =ROW()-22 -> 39 | B61: I（me/my） | C61: 我
A62: =ROW()-22 -> 40 | B62: if | C62: 如果
A63: =ROW()-22 -> 41 | B63: in | C63: 在
A64: =ROW()-22 -> 42 | B64: into | C64: 进入
A65: =ROW()-22 -> 43 | B65: it | C65: 它
A66: =ROW()-22 -> 44 | B66: just | C66: 仅仅
A67: =ROW()-22 -> 45 | B67: kind | C67: 友好
A68: =ROW()-22 -> 46 | B68: know | C68: 知道
A69: =ROW()-22 -> 47 | B69: like | C69: 喜欢
A70: =ROW()-22 -> 48 | B70: long | C70: 长
A71: =ROW()-22 -> 49 | B71: look | C71: 看
A72: =ROW()-22 -> 50 | B72: make | C72: 制造
A73: =ROW()-22 -> 51 | B73: many | C73: 许多
A74: =ROW()-22 -> 52 | B74: more | C74: 更多
A75: =ROW()-22 -> 53 | B75: need | C75: 需要
A76: =ROW()-22 -> 54 | B76: new | C76: 新
A77: =ROW()-22 -> 55 | B77: no/not | C77: 不/不是
A78: =ROW()-22 -> 56 | B78: now | C78: 现在
A79: =ROW()-22 -> 57 | B79: of | C79: 的
A80: =ROW()-22 -> 58 | B80: on | C80: 上
A81: =ROW()-22 -> 59 | B81: only | C81: 仅
A82: =ROW()-22 -> 60 | B82: or | C82: 或
A83: =ROW()-22 -> 61 | B83: other | C83: 其他
A84: =ROW()-22 -> 62 | B84: out | C84: 出
A85: =ROW()-22 -> 63 | B85: people | C85: 人们
A86: =ROW()-22 -> 64 | B86: please | C86: 请
A87: =ROW()-22 -> 65 | B87: say/speak | C87: 说
A88: =ROW()-22 -> 66 | B88: see | C88: 看见
A89: =ROW()-22 -> 67 | B89: sleep | C89: 睡觉
A90: =ROW()-22 -> 68 | B90: so | C90: 所以
A91: =ROW()-22 -> 69 | B91: some | C91: 一些
A92: =ROW()-22 -> 70 | B92: sorry | C92: 对不起
A93: =ROW()-22 -> 71 | B93: take | C93: 拿
A94: =ROW()-22 -> 72 | B94: talk | C94: 说
A95: =ROW()-22 -> 73 | B95: tell | C95: 告诉
A96: =ROW()-22 -> 74 | B96: than | C96: 比
A97: =ROW()-22 -> 75 | B97: thanks | C97: 谢谢
A98: =ROW()-22 -> 76 | B98: that | C98: 那个
A99: =ROW()-22 -> 77 | B99: the | C99: 这个
A100: =ROW()-22 -> 78 | B100: then | C100: 然后
A101: =ROW()-22 -> 79 | B101: there | C101: 那里
A102: =ROW()-22 -> 80 | B102: they/them | C102: 他们
A103: =ROW()-22 -> 81 | B103: thing | C103: 事物/东西
A104: =ROW()-22 -> 82 | B104: think | C104: 思考
A105: =ROW()-22 -> 83 | B105: this | C105: 这
A106: =ROW()-22 -> 84 | B106: time | C106: 时间
A107: =ROW()-22 -> 85 | B107: to | C107: 到
A108: =ROW()-22 -> 86 | B108: up | C108: 上
A109: =ROW()-22 -> 87 | B109: use | C109: 使用
A110: =ROW()-22 -> 88 | B110: very | C110: 非常
A111: =ROW()-22 -> 89 | B111: want | C111: 想要
A112: =ROW()-22 -> 90 | B112: way | C112: 方式
A113: =ROW()-22 -> 91 | B113: we | C113: 我们
A114: =ROW()-22 -> 92 | B114: well | C114: 好
A115: =ROW()-22 -> 93 | B115: what | C115: 什么
A116: =ROW()-22 -> 94 | B116: when | C116: 当
A117: =ROW()-22 -> 95 | B117: where | C117: 哪里
A118: =ROW()-22 -> 96 | B118: which | C118: 哪个
A119: =ROW()-22 -> 97 | B119: who | C119: 谁
A120: =ROW()-22 -> 98 | B120: will | C120: 将
A121: =ROW()-22 -> 99 | B121: with | C121: 随着
A122: =ROW()-22 -> 100 | B122: you | C122: 你
A124: 1 | B124: afternoon | C124: 下午
A125: 2 | B125: airport | C125: 飞机场
A126: 3 | B126: apple | C126: 苹果
A127: 4 | B127: banana | C127: 香蕉
A128: 5 | B128: bathroom | C128: 卫生间
A129: 6 | B129: beautiful | C129: 漂亮
A130: 7 | B130: bed | C130: 床
A131: 8 | B131: beef | C131: 牛肉
A132: 9 | B132: boy | C132: 男孩
A133: 10 | B133: bread | C133: 面包
A134: 11 | B134: breakfast | C134: 早餐
A135: 12 | B135: bus | C135: 公共汽车
A136: 13 | B136: calculator | C136: 计算器
A137: 14 | B137: careful | C137: 小心
A138: 15 | B138: cash | C138: 现金
A139: 16 | B139: chicken | C139: 鸡
A140: 17 | B140: city | C140: 城市
A141: 18 | B141: cool | C141: 冷
A142: 19 | B142: country | C142: 国家
A143: 20 | B143: crash | C143: 撞车
A144: 21 | B144: causing | C144: 导致
A145: 22 | B145: day | C145: 天
A146: 23 | B146: dinner | C146: 晚餐
A147: 24 | B147: drink | C147: 饮料
A148: 25 | B148: driver | C148: 司机
A149: 26 | B149: egg | C149: 鸡蛋
A150: 27 | B150: Euro | C150: 欧元
A151: 28 | B151: Exchange | C151: 换钱
A152: 29 | B152: fish | C152: 鱼
A153: 30 | B153: food | C153: 食物
A154: 31 | B154: fried-rice | C154: 炒饭
A155: 32 | B155: friend | C155: 朋友
A156: 33 | B156: fries | C156: 炸薯条
A157: 34 | B157: girl | C157: 女孩
A158: 35 | B158: Hansen | C158: 英俊
A159: 36 | B159: holiday | C159: 度假
A160: 37 | B160: home | C160: 家
A161: 38 | B161: hot | C161: 热
A162: 39 | B162: hotel | C162: 酒店
A163: 40 | B163: hot-water | C163: 热水
A164: 41 | B164: hungry | C164: 饿
A165: 42 | B165: husband | C165: 丈夫
A166: 43 | B166: ice-cream | C166: 冰激凌
A167: 44 | B167: internet | C167: 上网
A168: 45 | B168: Japanese | C168: 日本人
A169: 46 | B169: Korean | C169: 韩国人
A170: 47 | B170: leave | C170: 离开
A171: 48 | B171: luggage | C171: 行李
A172: 49 | B172: lunch | C172: 中餐
A173: 50 | B173: man | C173: 男人
A174: 51 | B174: menu | C174: 菜单
A175: 52 | B175: milk | C175: 牛奶
A176: 53 | B176: minutes | C176: 分钟
A177: 54 | B177: morning | C177: 早上
A178: 55 | B178: name | C178: 姓名
A179: 56 | B179: newspaper | C179: 报纸
A180: 57 | B180: night | C180: 晚上
A181: 58 | B181: phone | C181: 电话
A182: 59 | B182: problem | C182: 问题
A183: 60 | B183: noodles | C183: 面
A184: 61 | B184: office | C184: 办公室
A185: 62 | B185: old | C185: 老的
A186: 63 | B186: door | C186: 门
A187: 64 | B187: orange | C187: 橙汁
A188: 65 | B188: passport | C188: 护照
A189: 66 | B189: pen | C189: 钢笔
A190: 67 | B190: police | C190: 警察
A191: 68 | B191: pork | C191: 猪肉
A192: 69 | B192: railway | C192: 铁路
A193: 70 | B193: read | C193: 读
A194: 71 | B194: restroom | C194: 洗手间
A195: 72 | B195: rice | C195: 米饭
A196: 73 | B196: room | C196: 房间
A197: 74 | B197: salad | C197: 沙拉
A198: 75 | B198: soda | C198: 苏打
A199: 76 | B199: soup | C199: 汤
A200: 77 | B200: station | C200: 站
A201: 78 | B201: sugar | C201: 糖
A202: 79 | B202: ticket | C202: 门票
A203: 80 | B203: today | C203: 今天
A204: 81 | B204: tomorrow | C204: 明天
A205: 82 | B205: translate | C205: 翻译
A206: 83 | B206: travelling | C206: 旅行
A207: 84 | B207: understand | C207: 明白
A208: 85 | B208: US Dollar | C208: 美元
A209: 86 | B209: visa | C209: 签证
A210: 87 | B210: water | C210: 水
A211: 88 | B211: toilet/WC | C211: 厕所
A212: 89 | B212: weekend | C212: 周末
A213: 90 | B213: wife | C213: 妻子
A214: 91 | B214: wine | C214: 葡萄酒
A215: 92 | B215: woman | C215: 女人
A216: 93 | B216: work | C216: 工作
A217: 94 | B217: young | C217: 年轻的
A219: 1
A220: 2
A221: 3 | B221: Give me five more minutes please。 | C221: 再给我五分钟时间好吗？
A222: 4 | B222: How did you sleep? | C222: 你睡的怎么样？
A223: 5 | B223: Don't hog the bathroom! | C223: 别占着卫生间了！
A224: 6 | B224: Don't hog the shower. | C224: 别占着浴室了！
A225: 7 | B225: Don't hog my girlfriend. | C225: 别缠着我的女朋友了！
A226: 8 | B226: Get outta there! | C226: 快出来！
A227: 10 | B227: What are you in the mood for? | C227: 你想吃什么？
A228: 11 | B228: Who is gonna drive? | C228: 谁来开车？
A229: 12 | B229: You know what I mean? | C229: 你明白我的意思吗？
A230: 13 | B230: Could you run that by me again? | C230: 你能再说一遍吗？
A231: 14 | B231: So what you are trying to say is... | C231: 那么，你想说的是...
A232: 15 | B232: What did you do last night? | C232: 昨晚你干嘛去了？
A233: 16 | B233: Didja have a good time? | C233: 玩的开心吗？
A234: 17 | B234: Where Would you like to go tonight? | C234: 今晚你想上哪儿？
A235: 19 | B235: I've got to get outta here. | C235: 我得离开这儿了。
A236: 20 | B236: I've got to catch the bus. | C236: 我要去赶公共汽车了。
A237: 21 | B237: gotta=got to/wanna=want to/gonna=going to | C237: 无
A238: 22 | B238: Yo__taxi! | C238: 嗨，出租车！
A239: 23 | B239: Where to ? | C239: （你）要去哪儿？
A240: 24 | B240: I want to go to... | C240: 我要到...地方去。
A241: 25 | B241: What do I owe you ? | C241: 我该付你多少钱？
A242: 26 | B242: Let me out here. | C242: 让我在这儿下车。
A243: 27 | B243: HI! What's up, buddy? | C243: 嗨！ 还好吗？，伙计？
A244: 28 | B244: What have you been doing? | C244: 这些日子在干什么呢？
A245: 29 | B245: How ya' been?=How have you been? | C245: 这些日子过的怎么样？
A246: 30
A247: 31 | B247: Do I have any messages? | C247: 有人给我留言吗？
A248: 32 | B248: What's on the schedule for today? | C248: 今天有那些日程安排？
A249: 33 | B249: Has the boss come in yet? | C249: 老板来了吗？
A250: 34 | B250: Hello! This is Hogan,is William in? | C250: 你好！ 我是Hogan,请问William 在吗？
A251: 35 | B251: May I take your message? He is not in. | C251: 他现在不在。我可以为你留言吗？
A252: 36 | B252: I'm really busy. Can I call you back later? | C252: 我现在真的很忙，我晚点给你打过去，行吗？
A253: 37 | B253: Thank you for your time,goodbye! | C253: 占用您的时间了，谢谢您。再见！
A254: 38 | B254: Are you doing anything tonight/this weekend/tomorrow? | C254: 你今晚/周末/明天有空吗？
A255: 39 | B255: If you are not busy tonight, would you like to go out with me? | C255: 如果你今晚有空的话，愿不愿意和我一起出去？
A256: 40 | B256: Mayby we can get together sometime. | C256: 也许今后我们有机会在一起。
A257: 41 | B257: You look beautiful tonight. | C257: 今晚你看上去真美啊！
A258: 42 | B258: I've really had a good time tonight. | C258: 今晚我过的很开心。
A259: 43 | B259: I'd like to see you again sometime. | C259: 希望能再见到你。
A260: 44 | B260: How was your day? | C260: 今天过的怎么样？
A261: 45 | B261: How are things at work? | C261: 今天工作进行的怎么样了？
A262: 46 | B262: How are things at the office? | C262: 今天在公司怎么样？
A263: 47 | B263: How are thing at school? | C263: 今天在学校（过的）怎么样？
A264: 48 | B264: You'll never believe what happened to me today at shool/work. | C264: 你永远也猜不到今天我在学校/工作中遇上了什么事！！
A265: 49 | B265: You look great! Have you been working out? | C265: 你气色真好，你经常锻炼吗？
A266: 50 | B266: I need to get back in shape. | C266: 我要减回到原来的身材。
A267: 51 | B267: What do you do for exercise? | C267: 你经常做写什么运动呀？
A268: 51 | B268: You are something else! | C268: 你真是出类拔萃！
A269: 52 | B269: You are out of sight! | C269: 你真优秀！
A270: 54 | B270: I've been studing/working my tail off! | C270: 我学习/工作太紧张了！
A271: 55 | B271: I've got to cram for a test tomorrow. | C271: 为了明天的考试，我得背多少东西呀！
A272: 56 | B272: Hey,How did your English test go? | C272: 嗨，你英语考的怎么样？
A273: 57 | B273: Wow! Holy cow! That's great! | C273: 哇噻！太好了！真棒！
A274: 58 | B274: oh! No! That's terrible! | C274: 噢，太糟糕了！
A275: 59 | B275: What the heck is that? | C275: 究竟是怎么一回事？
A276: 60 | B276: Hey,what the heck is going on? | C276: 嗨，究竟发生了什么事？
A277: 61 | B277: Darn it all! Gush! | C277: 该死的!
A278: 62 | B278: Get to the point. | C278: 言归正传。
A279: 63 | B279: as a matter of fact | C279: 事实上
A280: 64 | B280: to get cold feet | C280: 吓的毛发直竖。
A281: 65 | B281: to give someone the cold shoulder | C281: 冷落某人
A282: 66 | B282: How did you say this word? | C282: 这个单词该怎么发音
A283: 67 | B283: I don't understand. | C283: 我不知道。
A284: 68 | B284: What's for breakfast? | C284: 早餐有些什么？
A285: 69 | B285: What do you want to have for breakfast? | C285: 你早餐想吃什么？
A286: 70 | B286: Would you like some coffee,juice or milk? | C286: 你想喝咖啡、果汁或者牛奶？
A287: 71 | B287: step into my office | C287: 到我办公室来！
A288: 72 | B288: Can I see you in my office? | C288: 到我办公室来一下好吗？
A289: 73 | B289: Can I talk with you for a little while? | C289: 我能和您谈谈吗？
A290: 74 | B290: I am a little a bit busy right now,can we talk later? | C290: 我现在比较忙，可不可以待会儿再谈？
A291: 75 | B291: Sure,no problem,right away! | C291: 没问题，马上就来！
A292: 76 | B292: What is it you wanted to talk to me about? | C292: 你想和我谈什么？
A293: 77 | B293: What is it? | C293: 你想谈什么？
A294: 78 | B294: Thank you very much for your time. | C294: 多谢您能抽空和我谈话。
A295: 79 | B295: Can you give me a hand? | C295: 能帮帮我吗？
A296: 80 | B296: Sure,no Porblem. | C296: 当然，没问题。
A297: 81 | B297: Now's a bad time. Can we do it later? | C297: 现在不太方便，能不能等一会儿？
A298: 82 | B298: Thanks for the hand. | C298: 谢谢您帮忙！
A299: 83 | B299: Can I buy you a drink? | C299: 我能请您喝一杯吗？
A300: 84 | B300: This one's on me . | C300: 我请客。
A301: 85 | B301: I'll drink to that! | C301: 我同意！
A302: 86 | B302: Would you like another round? | C302: 想再喝一圈吗？
A303: 87 | B303: I've had a hard day. | C303: 我今天过的真糟糕。
A304: 88 | B304: I'm fed up with... | C304: 我实在难以忍受...
A305: 89 | B305: I'm sick and tired of ... | C305: 我受不了...
A306: 90 | B306: I've had it up to here with... | C306: 我真受不了...
A307: 91 | B307: I really wish... | C307: 我多么希望...
A308: 92 | B308: Catch you later,buddy! | C308: 再见，老兄！
A309: 93 | B309: Take care! | C309: 保重！
A310: 94 | B310: See ya' later!/See ya'!/Later! | C310: 再见！
A311: 95 | B311: Adios! Ciao! Au revoir! | C311: 再见的几种用法(在美国很流行哦)。西班牙语、意大利语、法语
A312: 96 | B312: I didn't sleep a wink. | C312: 我简直没合过眼。
A313: 97 | B313: I slept like a log. | C313: 我睡的真沉！
A314: 98 | B314: My job is a nightmare. | C314: 我的工作（不好）真是噩梦啊！
A315: 99 | B315: Is your friend available? | C315: 你的朋友有男朋友吗？
A316: 100 | B316: Oh! She is already taken. | C316: 哦！她已经有男朋友了。
A317: 101 | B317: Do you think she is my type ? | C317: 你觉得她合适我吗？
A318: 102 | B318: I'm gonna go for it. | C318: 我要去追！
A319: 103 | B319: She is available. | C319: 她没男朋友。
A320: 104 | B320: Sorry,I'm all tied up right now. | C320: 对不起，我现在很忙。
A321: 105 | B321: All right.Maybe some other time. | C321: 好吧，那就下次吧。
A322: 105 | B322: I'm sorry,I've already got plans. | C322: 对不起，我已经和别人约好了。
A323: 106 | B323: That'll be the day. | C323: 不可能。（说的是反话）（语气上扬，若是肯定则语气下降）
A324: 107 | B324: Don't bet on it. | C324: 不可能。
A325: 108 | B325: Oh That's a great idea. | C325: 哦，你这主意真够傻的。（语气上扬）
A326: 109 | B326: Now that was a great meal. | C326: 这顿饭真够丰盛！
A327: 110 | B327: Are you up for some dessert? | C327: 你要不要来点甜食？
A328: 111 | B328: I couldn't eat another bite. | C328: 我实在吃不下了。
A329: 112 | B329: The toilet is backed up. | C329: 厕所堵上了。
A330: 113 | B330: The bulb is burnt out. | C330: 灯泡烧坏了。
A331: 114 | B331: to blow a fuse. | C331: 保险丝烧断了。
A332: 115 | B332: You look sick. How are you feeling? | C332: 你看起来不太舒服，你感觉怎么样？
A333: 116 | B333: I'm as sick as a dog. | C333: 我病的很重。
A334: 117 | B334: I'm a little under the weather. | C334: 我有点不舒服。
A335: 118 | B335: I hope you get better soon. | C335: 我希望你很快好起来。
A336: 119 | B336: This place is like a zoo | C336: 这个地方真热闹
A337: 120 | B337: This is a real hot spot | C337: 这个地区真繁华
A338: 121 | B338: This place is like a tomb | C338: 这个地区真冷清
A339: 122 | B339: He lives in the middle of nowhere | C339: 他离群索居
A340: 123 | B340: Can I try that on? | C340: 我可以试穿吗?
A341: 124 | B341: How does this look on me? | C341: 我穿这件看起来怎么样?
A342: 125 | B342: How does it fit? | C342: 这件衣服合不合身?
A343: 126 | B343: I'll take it | C343: 我买下它了
A344: 127 | B344: We're going out | C344: 我们开始约会了。
A345: 128 | B345: I got dumped | C345: 我被抛弃了。
A346: 129 | B346: Me and my girlfriend just broke up | C346: 我刚刚和女朋友分手了。
A347: 130 | B347: Come on, it's time to go | C347: 来吧，我们该走了。
A348: 131 | B348: Hold on, have we got everything? | C348: 等等，我们没忘带什么东西吧？
A349: 132 | B349: Where're we headed next? | C349: 接下来我们去哪儿？
A350: 133 | B350: My computer crashed | C350: 我的计算机系统崩溃了。
A351: 134 | B351: The server's down | C351: 服务器坏了。
A352: 135 | B352: It's on the fritz | C352: 它出故障了。
A353: 136 | B353: Do you know where there's a good hotel | C353: 你知道哪的饭店不错？
A354: 137 | B354: What are your rates? | C354: 费用多少？
A355: 138 | B355: What does that include? | C355: 包括了哪些服务？
A356: 139 | B356: When is check-out time? | C356: 什么时候必须结帐？
A357: 140 | B357: I'm here to fix the copier | C357: 我是来修复印机的。
A358: 141 | B358: What seems to be the problem? | C358: 哪儿出毛病了？
A359: 142 | B359: While you're here, could you check the TV | C359: 趁你还在这儿，能不能帮我检查一下电视。
A360: 143 | B360: I'm flat broke | C360: 我身无分文。
A361: 144 | B361: Can I bum some money off you ? | C361: 借点钱给我，好吗？
A362: 145 | B362: I think I can swing that | C362: 我想我应该能借给你一些吧。
A363: 146 | B363: How much do you want for that for that? | C363: 多少钱肯卖？
A364: 147 | B364: That much? | C364: 太贵了吧？
A365: 148 | B365: I'll tell you what, I'll give you | C365: 那我告诉你吧，我只能出
A366: 149 | B366: Take it or leave it | C366: 如果不行，我就走了。
A367: 150 | B367: That's my final offer | C367: 这是我最后的叫价了。
A368: 151 | B368: What a dork! | C368: 你有多傻呀！
A369: 152 | B369: What are you , nuts?! | C369: 你疯了吗？
A370: 153 | B370: What a jerk! | C370: 你这人怎么这样！
A371: 154 | B371: How about some lunch? | C371: 去吃午饭怎么样？
A372: 155 | B372: What do you feel like ? | C372: 你想吃点什么？
A373: 156 | B373: Could you tell me what's in this? | C373: 你能告诉我这种食品有哪些成分吗？
A374: 157 | B374: What do you think? | C374: 你觉得怎么样？
A375: 158 | B375: I could sure use a drink | C375: 我想喝杯酒。
A376: 159 | B376: Make it a double | C376: 我要双份的。
A377: 160 | B377: Let's have one more for the road | C377: 再喝一杯，咱们就回家吧。
A378: 161 | B378: Hay, check that out! | C378: 嗨，快看那边！
A379: 162 | B379: Is that cool, or what? | C379: 那个很不错，你觉得呢？
A380: 163 | B380: Watch out! | C380: 小心点儿！
A381: 164 | B381: I'm worm out! | C381: 我太累了。
A382: 165 | B382: Take a break | C382: 休息了一会儿。
A383: 166 | B383: I'm so tired, I can't think straight | C383: 我累的都没法清醒地思考问题了。
A384: 167 | B384: Take a nap | C384: 小睡一会儿。
A385: 168 | B385: I was caught in traffic | C385: 我今天堵车。
A386: 169 | B386: I missed my bus | C386: 我没赶上公共汽车。
A387: 170 | B387: I had(got) a flat. | C387: 我的车胎没气了。
A388: 171 | B388: It won't happen again | C388: 不会再发生类似事件了。
A389: 172 | B389: I can't hear myself think | C389: 我被这噪音吵得心烦伊意乱。
A390: 173 | B390: Could you keep it down, please? | C390: 小声一点，好吗？
A391: 174 | B391: Why don't you knock it off? | C391: 为什么不把它关掉？
B392: Can I take a rain check? | C392: 下次再说（再去/再办）怎么样？
A393: 175 | B393: I have to catch a plane. | C393: 我要赶飞机.
B394: Where does that come from? | C394: 这又从何说起？
B395: It doesn't look that way. | C395: 不是那么回事儿/不是那样滴。
B396: Stop fooling around! | C396: 别再混日子了！
A397: 33 | B397: That's monkey business! | C397: 胡闹！
B398: How should I put it? | C398: 我该怎么说呢？
B399: I'm really into music. | C399: 我真的很喜欢音乐。
B400: I have a reservation. My name is Alex. | C400: 我有预约，我的名字是Alex。
B401: I'm not very familiar with this place. | C401: 对这里不太熟悉。
B402: Are there any interesting places here? | C402: 这里有什么好玩的地方吗？
B403: This building is very beautiful, | C403: 这座建筑很漂亮，
B404: Can I take a picture? | C404: 我可以拍照吗？
B405: Excuse me. What's the time now? | C405: 打扰一下，现在几点了？
B406: Hello，What's the date today? | C406: 你好，今天几号了？
B407: Please give me a glass of water. | C407: 请给我一杯水。
B408: Out of my way!Here I come. | C408: 让开，我来了。
B409: Come again? I didn't hear you properly. | C409: 请再说一遍，我没听清楚。
B410: I didn't catch the last word. | C410: 我没听清最后一个词。
B411: She spent an hour putting on makeup. | C411: 她用了一个小时来化妆。
B412: Please speak a little slower. | C412: 请说慢一点。
B413: Where is the subway station? | C413: 地铁站在哪里？
B414: Hello, Do you speak English? | C414: 你好，你会说英语吗？
B415: We're going to miss the train. | C415: 我们要赶不上火车了。
B416: What's the next stop? | C416: 下一站是哪里？
B417: What's the deadline? | C417: 截止日期是什么时候？
B418: Look back at the past | C418: 回顾过去
B419: The cold rain came down. | C419: 下起了冰冷的雨。
B420: How much is this? | C420: 这个东西多少钱
B421: This is too expensive. | C421: 这个太贵了。
B422: Is there a discount? | C422: 有折扣吗？
B423: I'll text you. | C423: 我会发短信给你。
B424: She's my kinda girl. | C424: 她是我喜欢的那种类型。
B425: What's your take? | C425: 你觉得如何？你什么想法？
B426: Same here. | C426: 同感/彼此彼此。
B427: yeah，right! | C427: 才怪！它常用于讽刺的回答，如The test is easy. Yeah, right!测试很简单。才怪！
B428: what do you mean? | C428: 你什么意思？它本意是想问清楚对方的意思；但它也可用于挑衅及威胁，代表不满对方的意见。
B429: By the way, | C429: 顺便说一下，
B431: you must hold out a few more minutes. | C431: 你一定要再坚持几分钟。
B432: After walking all day, I'm tired. | C432: 走了一天，我累死了。
A433: 79 | B433: Is there a hotel near here? | C433: 附近有酒店吗？ | D433: Y a-t-il un hôtel près ? | E433: Есть отель рядом? | F433: هل هناك فندق قريب من هنا؟ | G433: ¿Hay un hotel cerca? | H433: 近くにホテルはありますか。 | I433: 근처에 호텔이 있습니까? | J433: Có khách sạn gần đây không?
A434: 107 | B434: My car broke down. | C434: 我的车抛锚了 | D434: Ma voiture s'est cassée. | E434: Моя машина сломалась. | F434: انهارت سيارتي | G434: Mi coche se rompió. | H434: 車が立ち往生した | I434: 내 차가 고장났다 | J434: Xe của tôi bị hỏng.
A435: 117 | B435: Pull yourself together. | C435: 振作起来。 | D435: Tirez-vous ensemble. | E435: Сдержите себя вместе. | F435: سحب نفسك معاً | G435: Reúnete. | H435: 元気を出して。 | I435: 분발하다. | J435: Hãy kéo bản thân lại với nhau.
A436: 124 | B436: Sorry, I wasn't listening. | C436: 对不起，我没在听。 | D436: Désolé, je n'écoutais pas. | E436: Прости, я не слушал. | F436: آسف، لم أستمع | G436: Lo siento, no estaba escuchando. | H436: すみません、聞いていません。 | I436: 미안합니다. 듣고 있지 않습니다. | J436: Xin lỗi, tôi không nghe.
A437: 127 | B437: Thank heavens，it's Friday/Week 5. | C437: 感谢上天，星期五了。 | D437: Dieu merci, c'est vendredi/semaine 5. | E437: Слава богу, пятница/пятая неделя. | F437: الحمد لله إنه يوم الجمعة / الأسبوع الخامس. | G437: Gracias a Dios, es viernes/semana 5. | H437: 神様、金曜日ありがとうございました。 | I437: 하느님 감사합니다. 금요일입니다. | J437: Cảm ơn trời, đây là thứ Sáu / Tuần 5.
A438: 140 | B438: This Chinese dish is delicious. | C438: 这个中国菜好吃。 | D438: Ce plat chinois est délicieux. | E438: Китайское блюдо очень вкусно. | F438: هذا الطبق الصيني لذيذ. | G438: Este plato chino es delicioso. | H438: この中華料理はおいしいです。 | I438: 이 중국 요리는 맛있어요. | J438: Món Trung Quốc này rất ngon.
A439: 147 | B439: What have you been up to? | C439: 你最近在忙什么？ | D439: Qu'avez-vous fait ? | E439: Что ты делал? | F439: ماذا كنت تفعل؟ | G439: ¿Qué has estado haciendo? | H439: あなたは最近何をしていますか。 | I439: 당신은 요즘 무엇을 하고 있습니까? | J439: Anh đã làm gì vậy?
A440: 155 | B440: You can say that again. | C440: 说得没错 | D440: Vous pouvez le dire à nouveau. | E440: Вы можете сказать это еще раз. | F440: يمكنك أن تقول ذلك مرة أخرى. | G440: Puedes decirlo otra vez. | H440: その通りだ | I440: 맞아요 | J440: Anh có thể nói một lần nữa.
A441: 129 | B441: Thank you for your help. | C441: 谢谢 | D441: Merci pour votre aide. | E441: Спасибо за помощь. | F441: شكراً لمساعدتك | G441: Gracias por su ayuda. | H441: ありがとう | I441: 감사합니다 | J441: Cảm ơn đã giúp đỡ.
A442: 130 | B442: Thank you in advance. | C442: 提前谢谢你。 | D442: Merci à l'avance. | E442: Спасибо заранее. | F442: شكراً مقدماً. | G442: Gracias de antemano. | H442: 前もってありがとう。 | I442: 미리 고마워요. | J442: Cảm ơn trước.
A443: 160 | B443: You should go an extra mile. | C443: 你应该更努力。 | D443: Vous devriez aller un kilomètre supplémentaire. | E443: Ты должен пройти дополнительную милю. | F443: يجب عليك الذهاب ميلا إضافيا. | G443: Deberías ir una milla extra. | H443: 君はもっと努力すべきだ。 | I443: 너는 더욱 노력해야 한다. | J443: Bạn nên đi thêm một dặm.
A444: 135 | B444: There is no room for doubt. | C444: 毫无疑问。 | D444: Il n'y a pas de place au doute. | E444: Нет места для сомнений. | F444: ليس هناك مجال للشك. | G444: No hay espacio para dudas. | H444: 間違いありません。 | I444: 의심의 여지가 없다. | J444: Không có chỗ cho nghi ngờ.
B445: Big deal! | C445: 有什么大不了的啊！ | D445: Grand truc ! | E445: Большое дело! | F445: صفقة كبيرة! | G445: ¡Gran cosa! | H445: 大したことないよ！ | I445: 뭐가 그리 대단해! | J445: Sự kiện lớn!
A446: 51 | B446: I have some questions to ask. | C446: 我有一些问题想咨询。 | D446: J'ai quelques questions à poser. | E446: У меня есть вопросы. | F446: لدي بعض الأسئلة لأسألها | G446: Tengo algunas preguntas que hacer. | H446: いくつか質問があります。 | I446: 문의드리고 싶은 게 있어서요. | J446: Tôi có vài câu hỏi.
A447: 61 | B447: I'll be with you in a minute. | C447: 马上就来。 | D447: Je serai avec toi dans une minute. | E447: Я буду с тобой через минуту. | F447: سأكون معك بعد دقيقة | G447: Estaré contigo en un minuto. | H447: すぐ来ます。 | I447: 금방 올게요. | J447: Tôi sẽ đến với anh trong một phút.
A448: 79 | B448: It was lucky you came along. | C448: 真幸运你来了。 | D448: J'ai eu de la chance que tu sois venu. | E448: Мне повезло, что ты приехал. | F448: لقد كنت محظوظاً أنك جئت | G448: Fue suerte que viniste. | H448: あなたが来てよかった。 | I448: 네가 와서 정말 다행이다. | J448: May mắn là anh đến cùng.
A449: 99 | B449: Let's grab a bite. | C449: 我们随便吃点东西吧。 | D449: Prenons une morsure. | E449: Давайте поедем. | F449: دعونا نأخذ عضة. | G449: Vamos a dar un bocado. | H449: 私たちは勝手に何か食べましょう。 | I449: 우리 아무거나 먹자. | J449: Đi ăn thôi.
A450: 37 | B450: How long have you been here? | C450: 你来这里多久了 | D450: Depuis combien de temps êtes-vous ici ? | E450: Как давно ты здесь? | F450: منذ متى كنت هنا؟ | G450: ¿Cuánto tiempo llevas aquí? | H450: ここに来てどれくらい経ちましたか。 | I450: 여기 온 지 얼마나 됐어요? | J450: Anh ở đây bao lâu rồi?
A451: 29 | B451: Good luck and God bless you. | C451: 祝好运，愿上帝保佑你。 | D451: Bonne chance et que Dieu vous bénisse. | E451: Удачи и Бог благословит тебя. | F451: حظا سعيدا و الله يباركك | G451: Buena suerte y Dios te bendiga. | H451: 幸運を祈り、神のご加護を祈ります。 | I451: 행운을 빕니다. 신의 가호가 있기를 바랍니다. | J451: Chúc may mắn và Chúa ban phước cho bạn.
B452: Freaking awesome. | C452: 碉堡了！ | D452: C'est incroyable. | E452: Чёртовски потрясающее. | F452: رائع جداً. | G452: Increíble. | H452: すごい！ | I452: 대단해! | J452: Thật tuyệt vời.
A453: 21 | B453: Fingers crossed. | C453: 祝你好运。 | D453: Les doigts croisés. | E453: Пальцы скрещены. | F453: أصابع متقاطعة. | G453: Dedos cruzados. | H453: 万事順調をお祈りします。 | I453: 행운을 빕니다. | J453: Ngón tay chéo chéo.
A454: 39 | B454: I come from the UK. | C454: 我来自英国。 | D454: Je viens du Royaume-Uni. | E454: Я из Великобритании. | F454: أنا من المملكة المتحدة. | G454: Yo vengo del Reino Unido. | H454: 私はイギリス出身です。 | I454: 저는 영국에서 왔습니다. | J454: Tôi đến từ Anh.
A455: 51 | B455: I want to order takeout. | C455: 我想点外卖。 | D455: Je veux commander à emporter. | E455: Я хочу заказать заказ. | F455: أريد أن أطلب تناول الطعام | G455: Quiero pedir comida para llevar. | H455: 私は外食を注文したいです。 | I455: 배달을 시키려고 합니다. | J455: Tôi muốn đặt hàng takeout.
A456: 67 | B456: I'm not myself. | C456: 我烦透了。 | D456: Je ne suis pas moi-même. | E456: Я не сам собой. | F456: أنا لست نفسي | G456: No soy yo mismo. | H456: 私はうんざりしている。 | I456: 지겨워 죽겠어요. | J456: Tôi không phải chính mình.
A457: 86 | B457: Let's go downstairs to the park. | C457: 下楼去公园 | D457: Descendons dans le parc. | E457: Спустимся вниз в парк. | F457: لننزل إلى الحديقة | G457: Vamos abajo al parque. | H457: 下に降りて公園に行く | I457: 아래층으로 내려가서 공원에 가다 | J457: Đi xuống công viên.
A458: 61 | B458: I'm answering the phone. | C458: 他正在接电话 | D458: Je réponds au téléphone. | E458: Я отвечаю на телефон. | F458: سأجيب على الهاتف | G458: Estoy contestando el teléfono. | H458: 彼は電話に出ている | I458: 그는 지금 전화를 받고 있다 | J458: Tôi đang trả lời điện thoại.
A459: 124 | B459: Wait a moment,I'm not ready yet. | C459: 等一下，我还没准备好呢。 | D459: Attendez un moment, je ne suis pas encore prêt. | E459: Подожди минутку, я еще не готов. | F459: انتظر لحظة، أنا لست جاهزا بعد. | G459: Espera un momento, todavía no estoy lista. | H459: ちょっと待って、私はまだ準備ができていません。 | I459: 잠깐만, 나 아직 준비 안 됐어. | J459: Chờ một chút, tôi chưa sẵn sàng.
A460: 131 | B460: Where are you from? | C460: 你来自哪里 | D460: Tu viens d'où ? | E460: Откуда ты? | F460: من أين أنتِ؟ | G460: ¿De dónde eres? | H460: どこから来ましたか | I460: 어디서 오셨어요? | J460: Anh đến từ đâu?
A461: 132 | B461: Where is the washroom/restroom? | C461: 洗手间在哪里？ | D461: Où est la toilette ? | E461: Где туалет? | F461: أين الحمام؟ | G461: ¿Dónde está el baño? | H461: トイレはどこですか。 | I461: 화장실이 어디에 있어요? | J461: Phòng vệ sinh ở đâu?
A462: 136 | B462: You rule! | C462: 你太牛了！ | D462: Vous gouvernez ! | E462: Вы правите! | F462: أنت تحكم! | G462: ¡Usted gobierna! | H462: あなたはすごいですね。 | I462: 너는 정말 대단하다! | J462: Anh cai trị!